{
  "request_id": "req_abc123",
  "hold_id": "hold_del_mar_abc123",
  "facility_id": "del_mar_fairgrounds",
  "status": "held",
  "animals_held": {"horses": 8, "cattle": 100},
  "expires_at": "2017-12-07T20:05:00Z",
  "capacity_version": 42,
  "replied_at": "2017-12-07T18:05:01Z",
  "schema_version": "0.2"
}
